{
  "lagna_sign": "Capricorn",
  "lagna_lord": "Saturn",
  "moon_sign": "Taurus",
  "moon_afflicted": false,
  "saturn_theme": "Responsibility through structure",
  "rahu_ketu_emphasis": false,
  "life_direction_hint": "Gradual ascent through responsibility",
  "timing_sensitivity_hint": "medium",
  "current_phase_hint": "Disciplined consolidation phase",
  "notes": []
}
